{
  "schema_version": "0.1.0",
  "region_id": "B",
  "label": "Kuzey Alaska aday dikdörtgeni: parçalı erişim teknik modül denemesi",
  "selection_status": "candidate",
  "candidate_bbox": [
    -156,
    68,
    -150,
    70
  ],
  "candidate_window_version": "search-window-0.1.0",
  "start_year": 2019,
  "end_year": 2019,
  "mask": "none"
}
