{
  "schema_version": "0.1.0",
  "region_id": "A",
  "label": "Colorado çevresi aday dikdörtgeni: maskesiz teknik alan denemesi",
  "selection_status": "candidate",
  "candidate_bbox": [
    -113,
    36,
    -109,
    39
  ],
  "candidate_window_version": "search-window-0.1.0",
  "start_year": 2016,
  "end_year": 2016,
  "mask": "none"
}
